{
  "$schema": "http://json-schema.org/draft-07/schema#",
  "type": "object",
  "required": ["name", "description"],
  "properties": {
    "name": { "type": "string", "minLength": 1 },
    "description": { "type": "string", "minLength": 1 },
    "tags": { "type": "array", "items": { "type": "string" } },
    "triggers": { "type": "array", "items": { "type": "string" } },
    "version": { "type": "string" }
  },
  "additionalProperties": false
}
